,processed_text
196,background worldwide outbreak coronavirus disease covid- bring disaster people world researcher carry clinical epidemiological study patient covid- previously risk factor patient different level severity unclear method  patient laboratory confirm covid-  hospital china include retrospective study related clinical information therapy imaging datum extract electronic medical record compare patient severe non severe status explore risk factor associate different severity covid- patient logistic regression method result base guideline cite  patient classify non severe  severe age range year median age  iqr .- elderly patient old  year old non severe group likely suffer fever asthma accompany high level d dimer red blood cell distribution width low density lipoprotein furthermore find liver kidney function male patient bad female patient severe non severe group different age level severe female fast esr low inflammatory marker major laboratory marker non severe case baseline albumin lymphocyte percentage high white blood cell neutrophil count low addition severe patient likely accompany increase cystatin c mean hemoglobin level decrease oxygen saturation advanced age indicator count white blood cell glucose prove common risk factor prevent covid- patient aggravate conclusion potential risk factor find study show great significance prevent covid- patient aggravate turn critical case treatment focus gender age factor group different severity covid- pay attention specific clinical symptom characteristic improve efficacy personalized intervention treat covid- effectively
197,severity coronavirus disease covid- associate comorbiditie study demonstrate potential risk respiratory failure mortality covid- patient pre existing asthma select  adult covid- patient korean health insurance review assessment covid- database nationwide retrospective cohort study  patient asthma assess severity evaluate clinical outcome covid- compare patient asthma  adult covid- patient  asthma  asthma compare asthma significant risk factor respiratory failure mortality covid- patient odd ratio p p adjust age sex charlson comorbidity score history acute exacerbation p significant risk factor death covid- patient asthma asthma risk factor poor prognosis covid- asthma patient experience acute exacerbation previous year covid- show high covid relate mortality especially case old age male sex
198,background impact asthma coronavirus disease  covid- remain largely unknown objective investigate asthma prevalence patient covid- compare outcome patient asthma method systematic review meta analysis search pubmed embase web science study report asthma prevalence general patient covid- compare outcome patient asthma exclude duplicate publication review editorial comment single case report small case series case determine pool estimate effect random effect model result basis  study patient find great variability prevalence comorbid asthma patient covid- different country region range .% .% significant difference asthma prevalence find hospitalize nonhospitalized risk ratio rr ci .- severe nonsevere rr ci .- intensive care unit non intensive care unit rr ci .- dead survive rr ci .- intubate mechanically ventilate nonintubate mechanically ventilated rr ci patient covid- patient asthma low risk death compare patient asthma rr ci asthma associate high risk intubation mechanical ventilation rr ci conclusion great variability asthma prevalence patient covid- different country region asthma associate high covid- severity bad prognosis patient asthma find low risk death compare patient asthma
199,sars cov specific antibody particularly prevent viral spike receptor bind domain rbd interaction host angiotensin convert enzyme  ace receptor neutralize virus unknown feature serological response affect clinical outcome covid- patient analyze  longitudinal plasma sample  hospitalize covid- patient  sars cov infected outpatient asymptomatic individual cohort  patient die illness high ratio igg antibody target s rbd domain spike compare nucleocapsid antigen see outpatient mild illness versus severely ill patient plasma antibody increase correlate decrease viral rnaemia antibody response acute illness insufficient predict inpatient outcome pseudovirus neutralization assay scalable elisa measure antibody block rbd ace interaction correlate patient igg titer rbd outpatient asymptomatic individual sars cov- antibody include igg progressively decrease observation month post infection
200,background effect chronic inhale systemic corticosteroid use covid- susceptibility severity unclear patient chronic pulmonary disease rely corticosteroid control disease important understand risk use pandemic aim study use inhaled systemic corticosteroid affect likelihood develop covid- infection method national jewish health electronic medical record research database identify cohort subject test suspect covid- march  june testing result medication use comorbiditie obtain medical record follow comparison different propensity score weighting method overlap propensity score weighting analyze association medication use covid- diagnosis result cohort consist  patient test positive majority patient history chronic pulmonary disease significant association inhale corticosteroid use testing positive covid- interestingly systemic corticosteroid use associate low odd ratio ci test positive covid- similar result note analysis restrict chronic pulmonary disease asthma chronic obstructive pulmonary disease copd conclusion study support recommendation patient chronic pulmonary disease include asthma copd require treatment inhaled systemic corticosteroid continue use covid- pandemic
201,aim study nct investigate relationship platelet activation myocardial injury mortality patient affect coronavirus disease  covid- patient respiratory failure severe acute respiratory syndrome coronavirus  sars cov- infection enrol case patient clinical presentation negative sars cov- infection include control blood sample collect different time point inclusion t   day t   day t platelet aggregation light transmittance aggregometry circulate level soluble cd ligand scdl p selectin measure platelet biomarker differ case control scdl high covid- patient p covid- patient p selectin scdl level decrease t t high case require admission intensive care unit p p respectively patient myocardial injury die high value biomarker platelet activation p myocardial injury independent predictor mortality covid- patient admit hospital respiratory failure heighten platelet activation associate severity illness myocardial injury mortality.clinicaltrials.gov number nct
202,objective describe clinical manifestation severity child adolescent affect covid- treat sabara hospital infantil method cross sectional retrospective observational study case covid- confirm rt qpcr patient see hospital emergency room aid room icu analyze severity case classify accord chinese consensus result  child include predominance boy verify median age year total  child hospitalize  icu total comorbiditie predominance asthma fever cough nasal discharge frequent symptom respiratory symptom report child gastrointestinal symptom child asymptomatic  upper airway symptom  mild pneumonia  severe pneumonia hospitalized child young non hospitalize child month vs.  month hospitalize patient high frequency irritability dyspnea drowsiness respiratory distress low oxygen saturation hepatomegaly observe chest radiography perform  child abnormal exam child require mechanical ventilation death conclusion child adolescent affect covid- mild upper airway symptom clinical manifestation covid- severe young child exhibit gastrointestinal respiratory symptom frequently
203,background scant datum currently available potential link comorbid chronic lung disease cld risk severity coronavirus disease  covid- infection method describe clinical characteristic outcome patient covid- infection include patient comorbid respiratory disease primarily hospitalize pulmonology department strasbourg university hospital france retrospective single center study include confirm case covid- march  april compare symptom biological radiological finding outcome patient cld result  patient enrol median age  year  patient male overall patient n= preexisting cld include chronic obstructive pulmonary disease copd n= asthma n= patient transfer intensive care unit icu patient die unit cld predictive icu hospitalization significantly high total mortality observe vs. .% p patient conclusion result suggest lack representation cld covid- represent patient cohort pulmonology department cld risk factor icu management tendency high global mortality observe covid- patient cld study warrant determine risk covid- patient comorbid cld
204,introduction coronavirus disease covid- infection cause novel severe acute respiratory syndrome coronavirus- sars cov- primarily affect lung tobacco relate illness include asthma chronic obstructive pulmonary disease copd coronary artery disease know reduce lung capacity impair immune system body greatly influence ability fight novel coronavirus purpose state art literature review summarize evidence association tobacco use severity covid- manifestation method article describe association tobacco use severity covid- manifestation search pubmed medline google review cover relevant study subject publish january  september result tobacco use form smoking chewing significantly associate severe covid- outcome pre exist comorbiditie tobacco user cardiovascular disease diabetes respiratory disease hypertension find aggravate disease manifestation make treatment covid- patient challenging rapid clinical deterioration conclusion current review indicate nicotine exposure link cardiopulmonary vulnerability covid- tobacco use potential risk factor get viral infection severe manifestation current pandemic provide teachable moment break cycle nicotine addiction accelerate national tobacco control program achieve tobacco free world
205,background conflicting result literature frequency allergic disease covid- patient effect have allergic disease covid- disease severity little study purpose study try determine frequency allergic disease covid- patient effect have allergic disease covid- disease severity design method retrospective cross sectional study conduct patient diagnose covid- state hospital istanbul turkey patient contact phone approve participate study question sociodemographic characteristic body mass index smoking history atopic status rate atopic disease mild severe covid- patient risk estimate mild disease atopic non atopic covid- patient calculate result study population consist  adult covid- mean age year standard deviation year  male study population  .% subject atopic symptom wheeze rhinitis eczema subject atopic status .% subject wheeze .% rhinitis .% eczema  month atopic status associate time high odd mild disease atopic atopic find associate covid- severity p conclusion information atopic disease common covid- patient guide clinical risk classification
206,introduction novel coronavirus disease  covid- rapidly spread globe pre exist comorbiditie find dramatic effect disease course seek analyze effect asthma disease progression outcome covid- patient method conduct multi center retrospective study positively confirm covid- patient primary outcome interest hospital mortality secondary outcome intensive care unit icu admission intubation mechanical ventilation length hospital stay result total  covid- adult patient asthma  non asthma cohort mean age year include study frequency asthma hospitalize cohort univariate analysis reveal asthma patient likely obese versus .% p high frequency intubation .% versus .% p require long duration hospitalization versus p adjustment multivariable analysis show asthmatic patient associate high risk icu admission ci p endotracheal intubation ci p complication ci p asthmatic patient associate high odd prolonged hospital length stay ci p icu stay ci p kaplan meier curve show significant difference overall survival group p conclusion despite increase prevalence hospitalization eld asthmatic covid- patient adjustment variable associate increase severity bad outcome
207,severe acute respiratory syndrome coronavirus  sars cov- transmit human mainly contact droplet transmission entry cell mediate efficient binding spike s viral protein angiotensin convert enzyme- ace receptor acute respiratory distress syndrome ards cause sars cov- fulfill criterion berlin definition considerable proportion patient covid- dissociation relatively preserve lung mechanic severity hypoxaemia extent pneumococcal relate morbidity mortality largely unknown respiratory comorbiditie increase risk severe disease mortality sars cov- include chronic obstructive pulmonary disease asthma bronchiectasis fibrotic interstitial lung disease regardless aetiology pneumococcal seasonal influenza vaccination useful prevent substantial burden mortality high risk population general quarantine social distancing reduce infiltration virus community date therapeutic agent study currently examine hydroxychloroquine chloroquine ritonavir lopinavir remdesivir colchicine interleukin- inhibitor usage clinical practice base randomised clinical trial result view extreme caution remdesivir promising option rigorous effort way development safe successful vaccine sars cov-
209,pandemic coronavirus disease  covid- cause severe acute respiratory syndrome coronavirus  sars cov- cause unprecedented global social economic impact high number death risk factor identify progression covid- severe critical stage include old age male gender underlie comorbiditie hypertension diabetes obesity chronic lung disease heart liver kidney disease tumor clinically apparent immunodeficiency local immunodeficiency early type interferon secretion capacity pregnancy possible complication include acute kidney injury coagulation disorder thoromboembolism development lymphopenia eosinopenia laboratory indicator covid- laboratory parameter monitor disease progression include lactate dehydrogenase procalcitonin high sensitivity c reactive protein proinflammatory cytokine interleukin il)- il beta krebs von den lungen- kl- ferritin development cytokine storm extensive chest compute tomography imaging pattern indicator severe disease addition socioeconomic status diet lifestyle geographical difference ethnicity expose viral load day initiation treatment quality health care report influence individual outcome review highlight scientific evidence risk factor severity covid-
210,pandemic covid- emerge health crisis globally india extensively affect active case report till date present study focus demographic clinical laboratory profile patient tertiary level non covid respiratory care hospital retrospective observational study seventy seven sick patient fulfil covid suspect criterion admit isolation area rt pcr test designated laboratory  confirm covid- patient detailed demographic clinical laboratory profile covid- patient study mean age year male predominance majority case symptomatic common symptom cough follow breathlessness fever nineteen .% patient co morbidity  .% chronic lung disease comorbiditie nearly half patient require supplementary oxygen presentation patient invasive mechanical ventilation  patient require non invasive ventilation shift covid hospital conclude covid- patient chronic respiratory disease manifest high prevalence symptom high severity disease symptomatology covid- closely mimic acute exacerbation chronic lung disease cautious screening testing especially pulmonary department
211,severe acute respiratory syndrome coronavirus  infection cause coronavirus disease  covid- manifest range severity mild illness life threaten pneumonia multi organ failure severe covid- characterize inflammatory signature include high level inflammatory cytokine alveolar inflammatory infiltrate vascular microthrombi patient severe covid- produce unique serologic signature include increased likelihood igg afucosylated fc glycan fc modification severe acute respiratory syndrome coronavirus  iggs enhance interaction activate fcgamma receptor fcgammariiia incorporate immune complex fc afucosylation enhance production inflammatory cytokine monocyte include interleukin- tumor necrosis factor result disease severity covid- correlate presence proinflammatory igg fc structure include afucosylated igg.
215,background association severity coronavirus disease  covid- presence certain chronic condition suggest unlike influenza virus disease burden covid- patient asthma evident objective understand impact covid- patient asthma method big data analytic artificial intelligence savana manager clinical platform analyse clinical datum patient asthma january  result  patient asthma  .% suffer covid- compare asthmatic individual covid- patient asthma covid- significantly old versus  year predominantly female versus smoke frequently high prevalence hypertension dyslipidaemia diabetes obesity allergy relate factor rhinitis eczema common asthmatic patient covid- p addition high prevalence comorbiditie observe patient covid- require hospital admission use inhale corticosteroid ics low patient require hospitalisation covid- compare non hospitalise patient versus .% ci patient treat biologic n= .% show increase severity comorbiditie ear nose throat level covid relate hospitalisation patient relatively low conclusion patient asthma covid- old increase risk comorbidity relate factor ics biologic generally safe associate protective effect severe covid- infection
217,aim pre exist cardiovascular disease cvds propose identify patient high risk adverse coronavirus disease  covid- outcome existing evidence conflicting unclear pre existing cvd independently important predictor severe covid- method result nationwide danish cohort hospital screen covid- patient age /= investigate pre exist cvds predict -day risk composite outcome severe covid- ii cause mortality estimate -day risk cox regression model include age sex cvd comorbidity chronic obstructive pulmonary disease asthma diabetes chronic kidney disease illustrate cvd comorbiditie importance evaluate predict risk death severe infection sex age total  covid- hospital screen patient observe  august .% cvd .% severe infection  day .% die predict risk outcome age  man single cvd comorbiditie differ clinically meaningful amount compare man comorbiditie risk composite outcome severe infection woman heart failure .% ci atrial fibrillation .% ci show modest increase compare woman comorbiditie .% ci conclusion result show modest effect cvds increase risk poor covid- outcome important allow public health authority clinician provide tailored guidance cardiovascular patient heretofore group high risk disease status
218,coronaviruse rna virus cause disease upper low respiratory tract human animal lately new coronavirus cause pneumonia case detect wuhan china december soon virus identify severe acute respiratory syndrome world health organization name disease coronavirus disease- covid- country case begin appear second week march study aim investigate demographic characteristic risk factor patient diagnosis covid- total  patient female  male include study patient include study randomly select registration system information evaluate retrospectively mean age patient age range= risk factor catch disease evaluate determine risk factor  patient  patient close contact covid- patient social environment  patient travel history outside city  day common symptom patient cough fever dyspnea weakness sore throat diarrhea headache sputum common comorbid condition patient detect hypertension diabetes mellitus dm congestive heart failure allergic asthma chronic obstructive pulmonary disease rheumatoid arthritis coronary artery disease solid organ tumour depression epilepsy mean age  patient monitor intensive care unit  y mean age  patient follow service difference statistically significant p= group compare term comorbid disease presence dm high n= intensive care patient difference statistically significant p= addition majority patient patient hospitalize intensive care unit male p= smoking evaluate risk factor illness   patient intensive care unit smoking history patient die covid- smoking history finding suggest smoking increase severity covid- disease result knowledge disease increase rapidly share study risk factor transmission route clinical feature covid- infection affect world
219,introduction underlie disease critical role vulnerability population great morbidity mortality suffer covid- aim current study evaluate prevalence underlie disease die people covid- method current study conduct accord prisma guideline international database include pubmed scopus web science cochrane google scholar search relevant study  june relevant article report underlying disease die case covid- include analysis result screen exclude duplicate irrelevant study  article include analysis prevalent comorbiditie hypertension diabetes cardiovascular disease liver disease lung disease malignancy cerebrovascular disease copd asthma report underlying disease high low prevalence relate hypertension asthma estimate respectively conclusion summary underlie disease critical role poor outcome severity disease high mortality rate covid- case patient hypertension cardiovascular disease diabetes carefully monitor aware health protocol
220,background aim coronavirus disease  covid- pandemic global health emergency accord finding male patient covid- infection increase risk severe complication female cause issue unknown probably multifactorial sexual hormone affect immune system estrogen strengthen immune system testosterone suppress report high prevalence androgenic alopecia hospitalize patient covid- high risk respiratory disease increase use allergy asthma medication patient polycystic ovary syndrome pcos hyperandrogenism condition compare non pcos woman review aim evaluate androgens role covid- method  relate article   keyword androgen hormonal factor hair loss combination covid- medical research database result evidence transmembrane protease serine  tmprss expression lung tissue androgen regulate gene express mainly adult prostate interpret increase susceptibility male gender severe covid- complication angiotensin convert enzyme  ace- act functional receptor severe acute respiratory syndrome coronavirus  sars cov- male hormone effective ace- passageway simplify sars cov- entry host cell conclusion study severity symptom patient covid- hyperandrogenism condition compare control group recommend
221,severe acute respiratory syndrome coronavirus  sars cov- responsible covid- pneumonia pandemic precipitate huge pressure world social economic system disease severity vary individual sars cov- infection associate e.g. flu like symptom dyspnoea severe interstitial pneumonia acute respiratory distress syndrome multiorgan dysfunction generalized coagulopathy nitric oxide small signal molecule impact pleiotropic function human physiology involve significant effect covid- infection neurotransmitter involve neural olfactory process central nervous system infected patient report anosmia symptom additionally know vasodilator important coagulation mediator anti microbial effector inhibitor sars cov replication exhale strongly related type- inflammatory response find asthma suggest protective sars cov- infection report indicate use inhale effective therapy pandemic ventilation perfusion ratio covid- patient improve require mechanical ventilation aim mini review summarize relevant action beneficial treatment covid-
222,infection severe acute respiratory syndrome sars coronavirus- sars cov- causative agent new disease covid- risk severe covid- increase certain underlie comorbiditie include asthma cancer cardiovascular disease hypertension diabetes obesity notably exposure hormonally active chemical call endocrine disrupt chemical edcs promote cardio metabolic disease endocrine relate cancer immune system dysregulation link high risk severe covid- bisphenol bpa common edc exert effect receptor widely distribute human tissue include nuclear oestrogen receptor eralpha erbeta membrane bind oestrogen receptor g protein couple receptor gpr human nuclear receptor oestrogen relate receptor gamma paper focus potential role bpa promote comorbiditie associate severe covid- potential bpa induce effect key sars cov- infection mediator angiotensin convert enzyme  ace transmembrane serine protease  tmprss interestingly gpr appear exhibit great co localisation tmprss key tissue like lung prostate suggest bpa exposure impact local expression sars cov- infection mediator overall potential role bpa risk severity covid- merit investigation
223,purpose review matrix metalloproteinase mmps family  zinc dependent protease different biological pathological activity implicate disease nonselective mmp inhibitor know induce effect target individual mmps offer safe therapeutic potential disease provide concise overview mmp- give association pulmonary disease include asthma chronic obstructive pulmonary disease copd idiopathic pulmonary fibrosis progressive pulmonary fibrosis ppf occur coronavirus disease recent finding asthma copd ppf increase mmp- level associate inflammation and/or structural change lung negatively correlate functional parameter increased pulmonary mmp- level mmp- gene expression relate disease severity asthma copd target mmp- show potential animal model pulmonary disease human datum scarce summary potential role mmp- asthma copd ppf pathophysiological aspect await elucidation target mmp- provide insight mmp- related mechanism translate clinical outcome warrant research
