,processed_text
62,background novel coronavirus disease  covid- infect .% world population previous study examine risk factor mortality severity base hospitalize individual population base cohort study call provide evidence extrapolate general population aim examine association comorbiditie mortality disease severity individual covid- diagnose  ontario canada method finding conduct retrospective cohort study individual covid- ontario canada diagnose january  december case link health administrative database maintain ice cover resident ontario primary outcome cause -day mortality covid- diagnosis secondary outcome composite severity index contain death hospitalization examine risk factor outcome employ cox proportional hazard regression model logistic regression model adjust demographic socio economic variable comorbiditie result stratify age group total individual diagnose covid-  include study half .% n comorbidity median follow period  day common comorbiditie hypertension n asthma n diabetes .% n individual comorbidity high risk mortality compare hr ci p risk substantially elevate ci .- ci time number comorbiditie increase significant predictor mortality include comorbiditie solid organ transplant hr ci p dementia hr ci p chronic kidney disease hr ci p severe mental illness hr ci% p cardiovascular disease cvd hr ci .- diabetes hr p chronic obstructive pulmonary disease copd hr ci p cancer hr ci p hypertension hr ci p compare effect old age group comorbiditie associate high risk mortality severity individual  year old individual comorbiditie  year age group ci .- p time high risk mortality compare limitation include datum collect  new variant concern predominant ices database contain detailed individual level socioeconomic racial variable conclusion find solid organ transplant dementia chronic kidney disease severe mental illness cvd hypertension copd cancer diabetes rheumatoid arthritis hiv asthma associate mortality severity study highlight number comorbiditie strong risk factor death severe outcome young individual covid- finding suggest addition prioritize age vaccination priority group include young population multiple comorbiditie
63,objective study explore hospital journey patient intellectual disability id compare general population admission covid- wave pandemic demand inpatient resource high identify disparity treatment outcome design match cohort study id cohort  patient match base age sex ethnicity control group ratio compare outcome international severe acute respiratory emerge infections consortium clinical characterisation protocol uk setting admission covid- uk hospital datum symptom severity access intervention complication mortality length stay extract intervention non invasive respiratory support intubation tracheostomy ventilation admission intensive care unit icu result subjective present symptom loss taste smell frequently report id patient indicator severe disease altered consciousness seizure common control high rate cardiovascular risk factor asthma rheumatological disorder smoking id patient admit high respiratory rate median= range=- likely require oxygen therapy .% vs .% despite id patient ci likely receive non invasive respiratory support ci likely receive intubation ci likely admit icu hospital ci increase risk die covid- hospitalise die time fast ci compare control conclusion significant disparity healthcare people id general population covid- pandemic contribute excess mortality group
64,background conduct systematic review evaluate asthma increase risk severe disease adverse outcome subject covid- method query pubmed embase database study index december include study provide datum severe disease hospitalization icu care need mechanical ventilation mortality subject covid- asthma calculate relative risk report outcome interest random effect model summarize datum result retrieve citation include  study review publication report datum retrieve electronic record retrospective subject cohort  study judge high quality subject asthma covid- marginally high risk hospitalization summary relative risk ci severe disease summary relative risk ci icu admission summary relative risk ci mechanical ventilation summary relative risk ci mortality summary relative risk ci compare subject covid- asthma conclusion comorbid asthma increase risk covid relate hospitalization severe disease adverse outcome subject covid-
65,covid- pandemic continue case report publish patient severe asthma biological agent survive mild course illness encourage continuation biological therapy patient severe asthma contrary previous information severe course covid- recently report severe asthmatic biological therapy compare general population evaluate covid- rate disease severity severe asthmatic biological agent retrospective study conduct patient severe asthma treat biological agent datum concern subject contract covid- severity disease evaluate eihgty severe asthmatic biological agent omalizumab mepolizumab aged year mean standard deviation female male ratio  .% include study participant  .% contract covid- course covid- mild .% moderate patient .% patient severe course covid- mechanical ventilation intensive care follow require patient .% treat inpatient participant survive covid- recovery death occur case high rate covid- find patient severe asthma biologic compare report previous report patient covid- mild moderate disease course
66,introduction asthma common chronic disease worldwide disease respiratory tract site entry sars cov- virus important interplay asthma covid- disease area cover report asthma prevalence hospitalize cohort covid- non allergic severe asthma increase risk worsen clinical outcome covid- infection explore epidemiology asthma risk factor severity covid- infection consider role covid- play lead exacerbation asthma impact asthma endotype outcome discuss lastly address safety common asthma therapeutic literature search perform relevant term section review pubmed google scholar medline expert opinion asthma diagnosis risk factor severe covid- especially severe disease nonallergic phenotype covid- appear provoke asthma exacerbation asthma therapeutic continue patient exposure covid- clearly topic remain unknown identify key question interest future researchers.[figure text
67,background fourth wave covid- osaka prefecture japan cause medical crisis aim identify risk factor covid- severity compare patient wave fourth wave method perform observational retrospective study covid- case national hospital organization kinki chuo chest medical center result identify  patient median age year interquartile range  .% mild disease  .% moderate disease  .% severe disease overall mortality rate base multivariate logistic regression analysis cardiovascular disease fever dyspnea inflammatory biomarker independent risk factor moderate severe disease  mg dl increase c reactive protein  iu l increase lactate dehydrogenase  ng ml increase ferritin risk moderate severe disease increase .% .% .% respectively overall disease severity fourth wave high wave significant difference mortality shortage bed  severe patient .% fourth wave transfer advanced hospital conclusion cardiovascular disease fever dyspnea inflammatory biomarker risk factor moderate severe covid- cohort fourth wave covid- severity worsen increase number patient transfer bed severe case result medical crisis osaka
68,background potential protective role eosinophil covid- pandemic arouse great interest give potential virus clearance function infection resistance asthma patient coronavirus unknown eosinophil count serve predictor severity covid- method total  patient confirmed covid- admit leishenshan hospital wuhan china enrol study include  patient general ward  patient intensive care unit icu medical datum analyze association eosinophil icu admission death result  patient covid- low eosinophil count ratio observe severe case adjust confounder affect outcome find eosinophil count predictor icu admission  icu patient  survive  die low eosinophil level indicator death severe covid- patient cutoff value x area curve ci p sensitivity specificity respectively conclusion research reveal low eosinophil level predictor death icu patient cause icu admission
69,purpose review june coronavirus disease  covid- exceed  million report case responsible  million death globally asthma affect approximately  million people worldwide important cause morbidity mortality presently appear asthma associate increase risk contract covid- risk severe covid- covid- relate death severe asthma patient biologic question remain purpose review discuss evidence relationship asthma biologic covid- recent finding available evidence suggest severe asthmatic treatment biologic high risk severe acute respiratory syndrome coronavirus  infection compare general population appear high risk severe disease covid- relate death summary review suggest treatment biologic severe asthma safe maintain covid- pandemic study need address question role biological therapy different asthma phenotype
70,introduction give ongoing coronavirus disease  covid- pandemic consequent global healthcare crisis urgent need well understand risk factor symptom deterioration mortality patient covid- systematic review aim meet need determine predictive value chronic disease covid- severity mortality method search pubmed embase web science cumulative index nursing allied health complete identify study publish december december seventeen observational study  country involve patient include assess risk bias include study perform cumulative meta analysis result find covid- patient hypertension common condition associate high severity intensive care unit icu admission acute respiratory distress syndrome mortality chronic obstructive pulmonary disease strong predictor covid- severity admission icu mortality asthma associate reduce risk covid- mortality patient obesity high risk experience severe symptom covid- mortality patient cerebrovascular disease chronic liver disease chronic renal disease cancer likely severe covid- case great probability mortality conclusion covid- patient chronic disease likely experience severe symptom icu admission face high risk mortality aggressive strategy combat covid- pandemic target patient chronic disease priority
71,background importance clinicolaboratory characteristic covid- report finding alborz province accord late national guideline diagnosis treatment covid- outpatient inpatient trial version  march iran emphasize rrt pcr result clinical feature comorbiditie laboratory finding patient accord severity disease method study  patient include primarily  fulfil inclusion criterion cross sectional center study involve  symptomatic adult hospitalize diagnosis covid- march  april perform analyze frequency rrt pcr result distribution comorbiditie initial clinicolaboratory datum severe non severe case compare compatibility method categorize severity disease result accord finding  patient rrt pcr positive .%  rrt pcr negative indicate significant difference severity group relate date symptom onset admission base national guideline vital sign symptom mean oxygen saturation frequency nausea show significant difference group p significant difference observe comorbiditie curb- group vital sign comorbiditie mean oxygen saturation diabetes hypertension htn hyperlipidemia chronic heart disease chd asthma show significant difference group p significant difference see symptom conclusion study rrt pcr result hospitalize patient covid- relate severity category initial clinical characteristic decrease oxygen saturation appear common abnormality severe non severe category national guideline index comprehensive categorize patient severity group curb- compatibility non severe group national guideline curb- category
72,summary allergic rhinitis ar common disease affect general population worldwide coronavirus  covid- pandemic era observational study analyse effect asthma chronic obstructive pulmonary disease risk develop covid- conduct datum ar limited paper review risk develop sars cov- infection carry ar patient outcome covid- disease covid- influence allergic nasal symptom psychological status ar patient adult paediatric population ar patient protect covid  infection datum influence ar severity covid- disease conclusive ar patient increase risk poor covid- prognosis clinical manifestation ar distinguish covid- symptom treat ar adequately strongly recommend especially pandemic
73,summary currently world engage coronavirus disease  covid- cause acute respiratory syndrome coronavirus  sars cov- infection center disease control prevention cdc propose moderate severe asthma risk factor covid- susceptibility severity current evidence identify asthma  comorbiditie associate covid- fatality raise question patient different type asthma vulnerable sars cov- infection like respiratory infection increased number eosinophil elevated angiotensin convert enzyme  ace expression asthma suppose mechanism associate decrease covid- susceptibility asthmatic study perform evaluate mention factor asthmatic patient compare healthy individual address mechanism investigate ace eosinophil protect asthmatic patient sars cov- infection
74,description reinfection sars cov- recently report study focus exclusively reinfected case consider epidemiological context event objective perform complete analysis sequential infection community transmission event sars cov- reinfection include infection event precede exposure subsequent transmission analysis support host genetic viral genome sequencing phylogenomic viral population analysis refine epidemiological datum obtain interview involved subject reinfection involve -year old woman asthma case covid- episode april  severe second episode -/ month later sars cov- seroconversion august require hospital admission extended genomic analysis allow demonstrate strain involve case reinfection circulate epidemiological context case transmit subsequently case family context reinfection support phylogenetic analysis include  strain madrid reveal strain involve reinfection circulate time case suffer second episode august september absent time range correspond case episode importance present complete analysis epidemiological scenario reinfection sars cov- severe episode include case precede reinfection reinfected case se subsequent transmission seven case
75,objective role overcrowded multigenerational household risk factor covid- remain unmeasured objective study examine quantify association overcrowded multigenerational household covid- new york city nyc study design cohort study method conduct bayesian ecological time series analysis zip code tabulation area zcta level nyc assess zcta high proportion overcrowded define proportion estimate number housing unit occupant room multigenerational household define estimate percentage residence occupy grandparent grandchild  year age independently associate high suspect covid- case rate nyc department health syndromic surveillance datum march  main measure adjust incidence rate ratio irr suspect covid- case population final model control zcta level sociodemographic factor median income poverty status white race essential worker prevalence clinical condition relate covid- severity obesity hypertension coronary heart disease diabetes asthma smoking status chronic obstructive pulmonary disease spatial clustering result suspect covid- case present emergency department  zcta nyc adjust covid- case rate increase irr ci zcta quartile versus percent overcrowdedness increase irr ci quartile versus percent live multigenerational housing interaction exposure significant betainteraction ci conclusion overcrowdedness multigenerational housing independent risk factor suspected covid- early phase surge covid case social distancing measure increase house bind population inadvertently temporarily increase sars cov- transmission risk covid- disease population
76,background beginning coronavirus disease  covid- pandemic increase urgency identify pathophysiological characteristic lead severe clinical course patient infect severe acute respiratory syndrome coronavirus  sars cov- human leukocyte antigen allele hla suggest potential genetic host factor affect individual immune response sars cov- seek evaluate hypothesis conduct multicenter study hla sequencing method analyze association covid- severity hla  individual germany n spain n switzerland n united states n enrol march  august study include patient old  year diagnose covid- represent spectrum disease finally test result meta analyse datum prior genome wide association study gwas finding describe potential association hla c severe clinical course covid- carrier hla c twice risk intubation infect sars cov- risk ratio ci odd ratio ci adjust p value finding base datum country corroborate independent result gwas finding biologically plausible hla c few predict binding site relevant sars cov- peptide compare hla allele interpretation hla c carrier state associate severe clinical course sars cov- finding suggest hla class allele relevant role immune defense sars cov- funding fund roche sequencing solutions inc.
77,background pre exist comorbiditie link sars cov- infection evidence sparse importance pattern multimorbidity condition severity infection indicate hospitalisation mortality aim use multimorbidity index develop specifically covid- investigate association multimorbidity risk severe sars cov- infection method datum uk biobank link laboratory confirm test result sars cov- infection mortality datum public health england march  july review current literature covid- derive multimorbidity index include angina asthma atrial fibrillation cancer chronic kidney disease chronic obstructive pulmonary disease diabetes mellitus heart failure hypertension myocardial infarction peripheral vascular disease stroke adjust logistic regression model assess association multimorbidity risk severe sars cov- infection hospitalisation death potential effect modifier association assess age sex ethnicity deprivation smoking status body mass index air pollution -hydroxyvitamin d cardiorespiratory fitness high sensitivity c reactive protein result participant median age  range year white .%  severe sars cov- infection prevalence multimorbidity double severe sars cov- infection compare cluster multimorbiditie common severe sars cov- infection common cluster severe sars cov- infection stroke hypertension stroke hypertension diabetes hypertension chronic kidney disease hypertension multimorbidity independently associate great risk severe sars cov- infection adjust odd ratio confidence interval compare multimorbidity risk remain consistent potential effect modifier great risk old age high risk severe infection strongly evidence ckd diabetes ci conclusion multimorbidity index help identify individual high risk severe covid- outcome provide guidance tailor effective treatment
78,introduction allergic disease play role predispose factor coronavirus disease  covid- aim study investigate allergic comorbidity association covid- patient method demographic datum clinical manifestation laboratory report radiologic finding underlie comorbidity patient study allergic disease identify standard ga()len questionnaire severity covid- assess visual analog scale vas intensive care unit icu report result  covid- patient admit hospital  .% present different allergic disease reverse association observe have allergic comorbidity severity covid- infection p relative risk confidence interval ci respective frequency asthma allergic rhinitis ar chronic rhinosinusitis crs atopic dermatitis chronic urticaria food drug allergy .% .% significantly ar reversely associate severity covid- p relative risk ci additionally patient present hypoxemia .% chest ct scan involvement interestingly patient allergic disease significantly low hypoxemia chest ct involvement compare non allergic patient p respectively conclusion result study establish allergic disease determine predispose factor severe acute respiratory syndrome sars coronavirus  sars cov- infection significantly ar patient develop mild clinical manifestation covid- admit icu compare non ar patient
79,background demonstration severe acute respiratory syndrome coronavirus type  sars cov- enter cell angiotensin convert enzyme  receptor raise concern hereditary angioedema hae disease characterize bradykinin mediate angioedema attack coronavirus disease  covid- trigger angioedema attack increase frequency and/or severity attack cause severe symptom covid- objective objective evaluate severity covid- patient hae course hae attack angioedema activity quality life score covid- pandemic method patient diagnose hae  month include study -day angioedema activity score angioedema quality life ae qol questionnaire complete onset pandemic march  june sars cov- infection month recover covid- result  patient hae .% diagnose covid- median interquartile range age  patient diagnose covid- year year  patient woman covid-  patient angioedema attack patient severe hae experience significant increase angioedema activity covid- compare basal activity score remain patient similar low attack frequency basal level  patient relative increase attack convalescence period statistically significant difference pre covid- covid- post covid- period function mood fear and/or shame nutrition total score ae qol questionnaire fear dimension relatively affected p conclusion sample size small analysis datum support symptom covid- severe hae significant difference ae qol questionnaire score frequency severity angioedema attack course covid- patient hae
80,datum pertain risk factor analysis coronavirus disease  covid- confound lack datum ethnically diverse population addition lack datum young adult study conduct assess risk factor predict covid- severity mortality hospitalize young adult retrospective observational study conduct center china india covid- patient aged year regression analysis predict adverse outcome perform parameter include age sex country origin hospitalization duration comorbiditie lymphocyte count national early warning score  news score admission total  patient east asians  south asians include predictive model intensive care unit icu admission variable news category ii high diabetes mellitus liver dysfunction low lymphocyte count area curve auc value sensitivity specificity predictive model mortality news category iii cancer decrease lymphocyte count auc value sensitivity specificity combine predictive model bronchial asthma low lymphocyte count contrast auc value sensitivity specificity news score presentation news supplement comorbidity profile lymphocyte count help identify hospitalize young adult risk adverse covid- outcome
81,introduction assess risk factor consequence infection severe acute respiratory syndrome coronavirus  sars cov- pregnancy essential guide clinical care previous study sars cov- infection pregnancy hospitalize patient exaggerated risk estimate severe outcome case sars cov- infection pregnant population include objective study identify risk factor outcome sars cov- infection pregnancy independent severity infection universally test population identify risk factor outcome severe infection require hospital admission material method prospective population base cohort study denmark datum danish national patient register danish microbiology database prospectively register datum medical record include pregnancy march  october  compare woman positive sars cov- test pregnancy non infected pregnant woman case sars cov- infection pregnancy identify prospectively register linkage ensure case identify case pregnant infection main outcome measure pregnancy delivery maternal neonatal outcome severe infection define hospital admission coronavirus disease  covid- symptom result  pregnancy  woman sars cov- infection pregnancy correspond incidence  pregnancy  .% require hospital admission covid- risk factor infection asthma odd ratio ci foreign bear ci risk factor hospital admission covid- include obesity ci smoking ci infection gestational age ga  week ga week ci ga week ci have asthma ci find difference obstetrical neonatal outcome conclusion   woman sars cov- infection pregnancy require admission hospital covid- risk factor admission comprise obesity smoking asthma infection ga  week severe adverse outcome sars cov- infection pregnancy rare
82,background objective ecological study suggest association exposure particulate matter mum pm coronavirus disease  covid- severity finding validate individual level study aim determine association long term pm exposure hospitalization individual patient infect severe acute respiratory syndrome coronavirus  sars cov- method estimate pm exposure residential zip code covid- patient diagnose university cincinnati healthcare system  march   september logistic regression determine odd ratio ci covid- hospitalization associate pm adjust socioeconomic characteristic comorbiditie result covid- patient include study .% hospitalize geometric mean sd pm mug m adjusted analysis  mug m increase annual average pm associate high hospitalization ci likewise  mug m increase pm estimate year  associated high hospitalization ci conclusion long term pm exposure associate increase hospitalization covid- stringent covid- prevention measure need area high pm exposure reduce disease morbidity healthcare burden
