,processed_text
0,introduction clear asthma frequent chronic disease childhood risk severe sars cov- infection pediatric population sars cov- infection affect lung function patient purpose aim investigate course consequence sars cov- infection child asthma determine risk factor decline lung function test method retrospective study asthmatic child coronavirus disease  covid- compare random control group asthmatic patient covid- addition clinical course effect lung function test covid- child asthma evaluate result eighty patient covid-  include study fever fatigue cough frequent symptom covid- severity covid-  patient .% mild clinical condition  moderate disease .% severe disease critically ill disease patient diagnose multisystem inflammatory syndrome child mis c patient suffer pneumothorax lung function test patient covid- infection analyze significant difference find fev .% vs .% p=. fvc% .% vs .% p=. fev fvc .% vs .% p=. value .% vs .% p/=% decrease fef- covid- infection conclusion covid- infection lead dysfunction small airway asthmatic child obesity independent risk factor decrease fef- long term effect covid- infection especially small airway require close monitoring child asthma article protect
1,march world health organization declare coronavirus disease  covid- pandemic till affect million spain million person world total million death spain observe hospitalize covid- patient covid- associate comorbidity show people underlie chronic illness likely grow seriously ill individual covid- past medical history cardiovascular disorder cancer obesity chronic lung disease diabetes neurological disease bad prognosis likely develop acute respiratory distress syndrome pneumonia covid- affect respiratory system variety way spectrum level disease severity depend person immune system age comorbiditie symptom range mild cough shortness breath fever critical disease include respiratory failure shock multi organ system failure covid- infection cause overall worsening previous respiratory disease asthma chronic obstructive pulmonary disease copd interstitial lung disease etc review aim provide information impact covid- disease pre exist lung comorbiditie
2,objective coronavirus disease  covid- pandemic emergency department utilization hospitalization rate allergic disease decline severity allergy admit patient low study aim determine prevalence allergic disease adolescent change trend covid- pandemic compare precede  year subject method analyze datum nationwide web base self report korea youth risk behavior survey  adolescent age year participate survey survey period divide pre pandemic period ii iii iv pandemic period period v current prevalence asthma allergic rhinitis atopic dermatitis allergic morbidity have condition change prevalence covid- pandemic analyze result datum participant analyze weight study population mean age year male .% prevalence asthma allergic rhinitis atopic dermatitis allergic morbidity .% .% .% .% respectively prevalence allergic morbidity increase periods iv decline significantly periods iv v. periods iv prevalence asthma decrease prevalence allergic rhinitis increase prevalence atopic dermatitis remain unchanged period v prevalence condition decrease conclusion necessary update management measure develop relevant policy response altered prevalence allergic disease outbreak covid-
3,importance sars cov- entry require tmprss cell surface protease antiandrogen therapy reduce expression tmprss objective determine temporary androgen suppression induce degarelix improve clinical outcome inpatient hospitalize covid- design setting participant hormonal intervention treatment veteran covid- requiring hospitalization hitch phase placebo control double blind randomized clinical trial compare efficacy degarelix plus standard care vs placebo plus standard care clinical outcome man hospitalize covid- require invasive mechanical ventilation inpatient enrol  department veterans affairs hospital july april datum analyze august  october intervention patient stratify age history hypertension disease severity centrally randomized degarelix subcutaneous dose  mg saline placebo standard care include limit supplemental oxygen antibiotic vasopressor support peritoneal dialysis hemodialysis intravenous fluid remdesivir convalescent plasma dexamethasone main outcomes measures composite primary end point mortality ongoing need hospitalization requirement mechanical ventilation day  randomization secondary end point time clinical improvement inpatient mortality length hospitalization duration mechanical ventilation time achieve temperature reference range maximum severity covid- composite end point  day result trial stop futility plan interim analysis time  evaluable patient include  patient randomize degarelix group  patient placebo group  initially plan median range age year common comorbiditie include chronic obstructive pulmonary disorder patient hypertension patient cardiovascular disease patient asthma patient diabetes patient chronic respiratory failure require supplemental oxygen baseline prior covid- patient primary end point significant difference degarelix placebo group patient vs  patient p similarly difference observe degarelix placebo group secondary end point include inpatient mortality patient vs  patient cause mortality patient vs  patent difference degarelix placebo group overall rate adverse event patient vs  patient adverse event patient vs  patient unexpected safety concern conclusion relevance randomized clinical trial androgen suppression vs placebo usual care man hospitalize covid- degarelix result amelioration covid- severity trial registration clinicaltrials.gov identifier nct
4,background chronic condition associate high risk severe coronavirus disease  covid- include asthma conflict conclusion risk severe disease population objective understand impact asthma covid- outcome cohort hospitalize patient association asthma severity bad outcome method identify hospitalize patient covid- confirmatory polymerase chain reaction testing n asthma n international classification diseases tenth revision code march  december determine asthma maintenance medication pulmonary function test high historical absolute eosinophil count immunoglobulin e. primary outcome include death mechanical ventilation intensive care unit icu admission icu hospital length stay analysis adjust demographic comorbiditie smoking status timing illness pandemic result unadjusted analysis find difference primary outcome patient asthma patient asthma adjust analysis patient asthma likely mechanical ventilation odd ratio confidence interval ci .- p icu admission odd ratio ci p long hospital length stay risk ratio ci p high mortality hazard ratio ci p compare non asthma cohort inhale corticosteroid use eosinophilic phenotype associate considerabledifference interestingly patient moderate asthma bad outcome patient severe asthma conclusion asthma associate severe covid- control factor
5,background high risk covid- infection severity man compare woman describe beginning pandemic role androgens recently highlight control key step coronavirus infection mediate transmembrane protease serin  tmprrs angiotensin convert enzyme  ace receptor lung tissue furthermore high incidence androgenic alopecia male covid- disease report objective study aim evaluate telogen effluvium te prevalence relationship clinical immunologic parameter sample patient consecutively evaluate recovery covid- pneumonia northern italy method overall  patient recruit month covid- pneumonia recovery  hospitalize respiratory intensive care unit remain one treat home extent te assess visual analogic scale thick bundle hair demographic clinical datum systemic inflammation biomarker evaluate result thirty patient report history te mean te vas score range woman high risk odd complain te compare male ci p association strong adjust covid- severity hospital admission vs home care ci p mg l oradj ci p il beta  ng l oradj ci p significantly associate te.conclusion exploratory study raise hypothesis hair shed strictly relate severity covid- disease underlie inflammation patient hormonal status key messagesthe presence telogen effluvium te significantly common woman high severity covid- disease play critical role important hormonal influence development te.the severity inflammation relate te covid- play role suggest high level crp platelet ilbeta
6,introduction current evidence indicate severity coronavirus disease  covid- low pediatric population local datum limited objective characterize clinical epidemiological aspect covid- infection patient young  year argentina population method cross sectional observational analytical study confirmed covid- patient age year see march  march   referral child hospital argentina multivariate analysis identify predictor severe case result total  covid- case include .% live metropolitan area buenos aires .% male patient median age year see epidemiological week .% history contact covid- patient .% family setting .% respiratory symptom .% general symptom .% gastrointestinal symptom .% neurological symptom .% symptom .% asymptomatic addition .% patient hospitalize .% severe critical course total  patient develop multisystem inflammatory syndrome history asthma bronchopulmonary dysplasia congenital heart disease moderate severe malnutrition obesity chronic neurological disease and/or age young  month independent predictor severity live vulnerable neighborhood protective factor conclusion half case refer history contact covid- patient family setting hospitalization base clinical criterion severity severity associate presence certain comorbiditie
7,background study aim compare outbreak coronavirus disease  covid- belgium tomographic biological clinical aspect artificial intelligence ai methodology perform observational retrospective study adult patient symptomatic seven day covid- infection diagnose chest compute tomography ct and/or reverse transcription polymerase chain reaction include study wave pandemic last march second wave last october december wave subgroup define depend respiratory failure occur course disease quantitative estimation covid- lung lesion perform ai radiologist radiology resident chest ct severity score calculate ai result  patient include study find statistically significant difference obesity hypertension asthma difference predominant second wave mixed distribution central peripherical pulmonary lesion note second wave difference note mortality respiratory failure complication radiological biological element chest ct severity score risk factor mortality respiratory failure mild agreement ai visual evaluation pulmonary lesion extension k conclusion march december cohort majority parameter analyze record significant change wave ai reduce experience performance gap radiologist well establish hospitalization criterion
8,background inhale corticosteroid establish long term treatment inflammatory respiratory disease asthma chronic obstructive pulmonary disease investigate treatment coronavirus disease  covid- anti inflammatory action inhale corticosteroid potential reduce risk severe illness result hyperinflammation covid- objective assess inhale corticosteroid effective safe treatment covid- maintain currency evidence living systematic review approach search method search cochrane covid- study register include central pubmed embase clinicaltrials.gov ictrp web science science citation index emerging citation index covid- global literature coronavirus disease identify complete ongoing study  october selection criterion include randomised control trial rct evaluate inhale corticosteroid covid- irrespective disease severity age sex ethnicity include follow intervention type dose inhale corticosteroid include follow comparison inhale corticosteroid plus standard care versus standard care placebo exclude study examine nasal topical steroid data collection analysis follow standard cochrane methodology risk bias assessment cochrane rob  tool rate certainty evidence grade approach outcome mortality admission hospital death symptom resolution time symptom resolution adverse event adverse event infection main result inhale corticosteroid plus standard care versus standard care placebo people confirm diagnosis moderate severe covid- find study include people confirm diagnosis moderate severe covid- people confirm diagnosis asymptomatic sars cov- infection mild covid- include rct allocate  participant  confirm mild covid- analyse subset total number participant recruit study female trial platform design participant allocate treatment group simultaneously include study community base recruit people able use inhaler device deliver steroid rely remote assessment self reporting outcome people old  year co morbidity hypertension lung disease diabetes study conduct high income country prior wide scale vaccination programme total  participant analyse inhaled corticosteroid arm budesonide  participant ciclesonide  participant  participant control arm study include people asymptomatic sars cov- infection respect follow outcome inhale corticosteroid compare standard care result little difference cause mortality day risk ratio rr confidence interval ci  participant low certainty evidence absolute term mean death  people receive inhale corticosteroid death  people receive intervention ci    people probably reduce admission hospital death  day rr ci  participant moderate certainty evidence probably increase resolution initial symptom day  rr ci  participant moderate certainty evidence reduce duration symptom resolution day day ci control group rate  day  participant low certainty evidence evidence uncertain effect adverse event study period rr ci  participant low certainty evidence result little difference adverse event day rr ci  participant low certainty evidence result little difference infection study period rr ci  participant low certainty evidence study report outcome subgroup e.g. age ethnicity sex perform subgroup analysis author conclusion people confirmed covid- mild symptom able use inhaler device find moderate certainty evidence inhale corticosteroid probably reduce combine endpoint admission hospital death increase resolution initial symptom day low certainty evidence suggest corticosteroid little difference cause mortality day  decrease duration symptom resolution know inhale corticosteroid increase decrease adverse event heterogeneity way report study low certainty evidence inhale corticosteroid decrease infection evidence identify come study high income setting budesonide ciclesonide prior vaccination roll out identify lack evidence concern quality life assessment adverse event people asymptomatic infection moderate severe covid-  ongoing complete unpublished rct identify trial registry address similar setting research question current body evidence expect incorporate finding study future version review monitor newly publish result rct inhale corticosteroid weekly basis update review evidence certainty evidence change
9,background severe acute respiratory syndrome coronavirus  sars cov- cause coronavirus disease  covid- challenge healthcare globally acute increase number hospitalize patient necessitate rigorous reorganization hospital care create circumstance previously identify facilitate prescribe error pes e.g. demanding work environment high turnover doctor prescribe expertise hospitalized covid- patient risk pes potentially result patient harm determine prevalence severity risk factor pe post covid- patient hospitalize wave covid- netherlands  month discharge method prospective observational cohort study recruit patient visit post covid- outpatient clinic academic hospital netherlands  month covid- hospitalization june  october  patient appointment eligible inclusion prevalence severity pes assess multidisciplinary consensus meeting odd ratio ors calculate univariate multivariate analysis identify independent risk factor pes result ninety patient include pe experienced medication relate harm require immediate change medication therapy prevent detoriation overall identify pes covid- relate hospitalization multivariate analysis identify icu admission ci medical history copd asthma ci independent risk factor pes conclusion pes occur frequently sars cov- pandemic patient admit icu covid- hospitalization medical history copd asthma risk pes risk factor identify high risk patient implement targeted intervention awareness prescribe safely crucial prevent harm new patient population
10,background coronavirus disease  covid- account  million case million death globally affect population nation develop transitional gender age extent specific involvement known study aim analyze determine different second wave covid- pandemic assess compute tomography severity score ct ss methodology retrospective cross sectional observational study perform tertiary care institution include  patient undergo ct chest june october  patient undergo ct chest february april include patient symptomatic confirm covid- positive compare ct ss dataset addition analyze distribution ct ss concern age comorbiditie gender difference wave covid- analysis perform spss version  ibm corp. armonk ny usa artificial intelligence platform u net architecture xception encoder analysis result study datum reveal mean ct ss differ statistically wave covid- age group affect second wave decade young overall disease predilection affect male finding show female afflict second wave covid- compare wave particular disease increase severity case comorbiditie hypertension diabetes mellitus bronchial asthma tuberculosis conclusion assessment demonstrate significant difference radiological severity score wave covid- secondary objective reveal wave show demographical difference iterate demographical subset population consider low risk disease manifestation heterogeneous
11,purpose acute respiratory syndrome coronavirus  sars cov- pandemic high impact patient chronic disease literature different perspective asthma comorbidity risk factor covid- severity patient method aim retrospective study  allergy department spain determine severity covid- asthmatic adult follow allergy department relationship atopy clinical demographic characteristic phenotype laboratory datum addition lung function test asthma control test act covid- analyze datum obtain electronic medical record march  april result asthmatic patient diagnose covid- infection validate detection test patient admit bilateral pneumonia advanced age elevated d dimer low number lymphocyte eosinophil heart disease hypertension associate severe covid- allergic mixed allergic eosinophilic phenotype biomarker total ige aeroallergens sensitization allergic rhinitis blood eosinophilia relate few hospital admission poor control lower forced expiratory volume second fev relate bad prognosis covid- conclusion asthmatic patient allergic eosinophilic phenotype well evolution covid- low risk admission old patient cardiovascular comorbiditie aerd eosinopenia relate severity covid-
12,management patient asthma coronavirus disease  covid- pandemic concern especially asthma predispose patient respiratory problem interestingly asthma characterize type  inflammation know t helper type endotype display cellular molecular profile confer protective effect covid- result experimental clinical study establish action immunoglobulin e ige induce airway hyperreactivity weaken interferon mediate antiviral response follow respiratory viral infection robust evidence support beneficial effect anti ige biologic treatment omalizumab reduce respiratory virus induce asthma exacerbation reduce frequency duration severity respiratory viral illness patient asthma accumulate report patient severe asthma treat omalizumab pandemic reassuringly show continue omalizumab treatment covid- safe fact help prevent severe course covid- accordingly guidance issue global initiative asthma recommend patient asthma continue take prescribed asthma medication include biologic therapy covid- pandemic impact biologic treatment patient asthma covid- well understand evidence emerge
13,background prospective population base study investigate multiple determinant pre vaccination antibody response sars cov- lack method prospective population base study sars cov- vaccine naive uk adult recruit  november positive swab test result sars cov- prior enrolment information  potential sociodemographic behavioural nutritional clinical pharmacological risk factor obtain online questionnaire combined igg iga igm response sars cov- spike glycoprotein determine dry blood spot obtain november april logistic linear regression estimate adjusted odd ratio aors adjust geometric mean ratio agmrs potential determinant sars cov- seropositivity participant antibody titre seropositive participant respectively result participant  .% seropositive factor independently associate high risk sars cov- seropositivity include frontline health care occupation aor ci international travel .- number visit shop indoor public place  vs. .- p trend body mass index bmi /=  vs. /= vs.  unit week light physical exercise associate low risk .-  vs. h week seropositive participant high titre anti spike antibody associate factor include bmi /=  vs. /=  vs. .- p trend association substantially attenuate adjustment covid- disease severity conclusion high alcohol consumption low light physical exercise represent new modifiable risk factor sars cov- infection recognise association south asian ethnic origin obesity high risk sars cov- seropositivity independent sociodemographic behavioural nutritional clinical pharmacological factor investigate seropositive participant high titre anti spike antibody people south asian ancestry obese people explain great covid- disease severity group
14,objective yupingfeng powder ypf kind preventative patent medicine choose treatment coronavirus disease  covid- high frequency application respiratory tract disease chronic obstructive pulmonary disease asthma respiratory tract infection pneumonia advantage reduce relapse rate severity active component ypf mechanism component affect covid- unclear study aim determine active constituent elucidate potential mechanism method ultra performance liquid chromatography quadrupole time flight mass spectrometry uplc q tof ms liquid chromatography triple quadrupole mass spectrometry lc qqq ms determine component absorbable constituent ypf secondly tcmsp drugbank swiss pharmmapper search target absorbable bioactive constituent ypf target covid- identify base genecards omim database string database filter possible inter protein interaction thirdly gene ontology enrichment analysis kyoto encyclopedia genes genomes kegg pathway analysis perform identify molecular function systemic involvement target gene result total  component ypf  absorbable constituent identify uplc q tof ms wogonin prim o glucosylcimifugin -o methylvisamminol astragaloside iv -o methylvisamminol hydroxylation vital constituent treatment covid- rela tnf il- mapk mapkere recognize key target ypf major metabolic reaction absorb constituent ypf demethylation hydroxylation sulfation glucuronidation kegg pathway analysis show important function ypf t cell activation response molecule bacterial origin cytokine receptor binding receptor ligand activity cytokine activity il- signal pathway chagas disease lipid atherosclerosis etc conclusion approach combine uplc q tof ms network pharmacology effective tool identify potentially bioactive constituent ypf key target treatment covid-
15,background coronavirus disease  covid- global health issue especially people pre existing health condition patient deal asthma presume high risk covid- cause severe respiratory distress main body initial stage pandemic clinical trial study assess association covid- asthma significant association report fact asthma case remain undiagnosed overlap respiratory feature difficult differentiate disease pathomechanism condition immune response generate response condition suggest presence condition likely influence presence severity condition far specific treatment know covid- use plasma therapy broad spectrum antiviral drug initial phase pandemic widespread vaccination phase give positive outcome reduce covid- case disease severity short conclusion take asthma increase risk factor covid- morbidity article aim provide comprehensive insight risk proper management asthma patient covid- pandemic common medication asthma patient suppress respiratory immune response facilitate cytokine storm covid- patient similarly risk viral induce asthma exacerbation different social issue shortage medicine sdoh delay clinical trial asthma patient inconvenience primary focus point reduce probable asthma attack severity prevent hospitalization asthma patient well management asthma patient maintain asthma action plan healthy lifestyle ensure nutritious diet develop self management intervention play crucial role
