,processed_text
128,background define socio demographic factor clinical presentation underlie disease associate covid- severity helpful management study aim clarify determinant clinical risk factor disease severity patient infect covid- method multi centre descriptive study patient diagnose covid- province tehran march  dec  conduct datum socio demographic characteristic clinical presentation comorbiditie health outcome patient examine characteristic study population describe assess association study variable disease severity chi squared test multiple logistic regression model apply result mean age study population year .% woman half patient present low level blood oxygen saturation icu admission rate .% overall mortality rate old age male sex comorbiditie include hypertension cancer chronic respiratory disease asthma chronic liver disease chronic kidney disease chronic neurological disorder hiv aids infection risk marker poor health outcome clinical presentation relate bad prognosis include fever difficulty breathing impaired consciousness cutaneous manifestation conclusion result alert physician pay attention determinant risk factor associate poor prognosis patient covid- addition finding aid decision maker emphasise vulnerable group public health strategy aim prevent spread disease mortality
129,inflammation characteristic marker numerous lung disorder immune cell macrophage dendritic cell eosinophil t b lymphocyte synthetize release cytokine involve inflammatory process gender difference incidence severity inflammatory lung ailment include asthma chronic obstructive pulmonary disease copd pulmonary fibrosis pf lung cancer lc infectious relate illness report effect sex hormone androgen estrogen testosterone tes beta estradiol e drive characteristic inflammatory pattern lung inflammatory disease investigate general androgen display anti inflammatory action estrogen produce pro inflammatory effect instance androgens regulate negatively inflammation asthma target type  innate lymphoid cell ilcs t helper th)- cell attenuate interleukin il)-a mediate response leukotriene lt biosynthesis pathway estrogen promote neutrophilic inflammation subject asthma copd activation estrogen receptor induce tumorigenesis chapter summarize recent advance functional role associated signal pathway inflammatory cellular response asthma copd pf lc newly occur covid- disease meticulously deliberate influence sex steroid development progress common severe lung disease
130,sex difference anatomy physiology respiratory system widely report intrinsic sex difference show modulate pathophysiology incidence morbidity mortality lung disease life span chapter describe epidemiology sex difference respiratory disease include neonatal lung disease respiratory distress syndrome bronchopulmonary dysplasia pediatric adult disease include asthma cystic fibrosis idiopathic pulmonary fibrosis chronic obstructive pulmonary disease lung cancer lymphangioleiomyomatosis obstructive sleep apnea pulmonary arterial hypertension respiratory viral infection respiratory syncytial virus influenza sars cov- discuss current state research mechanism underlie observe sex difference lung disease susceptibility severity importance consider sex gender variable research study design analysis
132,objective analysis describe clinical feature covid- early phase pandemic ghana method datum extract national covid- treatment center ghana  weeks(from march descriptive inferential statistic perform modify order logistic negative binomial regression analysis apply establish factor associate illness severity non communicable disease ncds count respectively analysis conduct confidence level p value /= stata result  patient average age preponderance male common symptom present cough .% headache .% sore throat .% patient history fever patient asymptomatic approximately underlying co morbid ncd hypertension .% diabetes .% asthma common odd moderate severe mos significantly high unknown exposure similar illness aor(%ci compare non exposure similar illness increased unit ncd count significantly increase odd covid- mos illness cor(%ci adjust age aor(%ci)=.(.- conclusion presence cardiovascular co morbidity dictate frequency report symptom severity covid- infection sample ghanaians physician aware presence co morbid ncd prepare manage effectively covid- patient funding declare
133,objective aim examine comorbiditie associate outcome illness severity death hospitalize patient coronavirus disease  covid- method datum provide national medical center korea disease control prevention agency datum include clinical epidemiological information patient hospitalize covid- discharge april  korea conduct comorbidity network multinomial logistic regression analysis identify risk factor associate covid- disease severity mortality outcome variable clinical severity score css categorize mild oxygen treatment need severe oxygen treatment need death result total patient include fully adjust model chronic kidney disease ckd odd ratio confidence interval ci chronic obstructive pulmonary disease copd ci significantly associate disease severity ckd ci heart failure hf ci malignancy ci dementia ci diabetes mellitus ci associate increase risk death asthma hypertension show statistically insignificant association increase risk death conclusion underlie disease contribute differently severity covid- efficiently allocate limited medical resource underlie comorbiditie closely monitor particularly ckd copd hf
134,background severe acute respiratory syndrome coronavirus  sars cov- cause coronavirus disease  covid- infect m patient result death worldwide major clinical feature severe covid- patient require ventilation acute respiratory distress syndrome ards possibly associate cytokine storm objective elucidate serum level tnf alpha soluble tnf receptor  stnfr patient severe mild covid- disease determinant disease severity method determine serum tnf alpha stnfr concentration  patient laboratory confirm covid- patient severe disease intensive care unit icu  non severe non icu patient  healthy control admission elisa subject recruit march  masih daneshvari hospital tehran iran result serum level stnfri significantly high icu patient p non icu patient p=. compare healthy subject serum stnfr significantly high icu patient non icu patient p serum tnf alpha level great icu non icu patient healthy subject group p stnfri concentration icu r=. p=. non icu r=. p=. patient positively correlate age serum stnfri level icu patient significantly high old healthy subject stnfri concentration icu patient negatively correlate esr conclusion study demonstrate high stnfri icu patient severe covid- disease biomarker disease severity mortality future study examine low level systemic stnfr admission indicate well disease outcome
135,context sars cov- population wide testing implement clinical feature antibody response infect document africa information provide analyze datum population wide testing critical understand infection dynamic devise control strategy describe clinical feature assess antibody response people screen sars cov- infection analyze datum cohort  people molecularly screen sars cov- infection routine activity record people sars cov- diagnosis age gender blood type white blood cell wbc symptom chronic disease status time sars cov- rt pcr conversion positive negative calculate age base distribution sars cov- infection analyze proportion spectrum covid- severity furthermore nested sub study screen  covid- patient  contact case anti sars cov- antibody male female account respectively people screen study population median mean age  year   people .% diagnose sars cov- infection male female represent respectively median mean age sars cov- infected subject   year respectively low rate infection observe elderly aged rate sars cov- infection young year old middle aged adult year old analysis sars cov- infection age distribution show middle aged adult account .% sars cov- positive person follow respectively young adult .% child .% elderly n sars cov- infected person asymptomatic n influenza like symptom n influenza like symptom associate anosmia ageusia n dyspnea n respiratory failure result death datum show sars cov- infected subject chronic disease hypertension diabetes asthma concurrent chronic disease represent respectively record chronic disease half sars cov- rt pcr positive patient cure  day follow initiation anti covid- treatment protocol .% covid- patient sars cov- rt pcr confirm negative contact case positive anti sars cov- antibody patient severe critical illness high leukocyte high neutrophil low lymphocyte count contrarily asymptomatic patient patient mild moderate illness neutrophilic leukopenia prevalent asymptomatic patient patient mild moderate disease  week diagnosis patient severe critical illness neutrophilic leukocytosis neutrophilia lymphocytopenia -% frequent participant blood type o. important note infection rate slightly high b blood type compare type o. african setting young middle aged adult likely drive community transmission covid- rate critical disease relatively low high rate anti sars cov- antibody observe sars cov- rt pcr negative contact case suggest subclinical infection overlook setting
136,coronavirus disease  covid- cause infection severe acute respiratory syndrome coronavirus  detect wuhan china late  continue spread worldwide persistent question remain relationship severity covid- comorbid disease chronic pulmonary condition systematic review meta analysis aim examine detail underlie chronic obstructive pulmonary disease copd asthma chronic respiratory disease crd associate increase risk severe covid- comprehensive literature search perform international search engine initial search  article identify eliminate duplicate record consideration eligibility criterion  study patient include final analysis copd present patient severe covid- patient non severe covid- random effect model ci z p crd present patient severe covid- patient non severe covid- random effect model ci z p asthma present patient severe covid- patient non severe covid- random effect model ci z p conclusion comorbid copd crd clearly associate high severity covid- association asthma severe covid- identify
137,chronic rhinosinusitis crs complex upper airway inflammatory disease broad spectrum clinical variant understanding disease pathophysiology evolve philosophy approach management crs endotyping gain favour phenotype base classification owe potential prognosticate disease severity deliver precision treatment endotyping especially useful challenge crs nasal polyposis case novel treatment option biological available late european position paper rhinosinusitis nasal polyps epos reflect change update rhinosinusitis classification new integrate care pathway coronavirus disease  covid- pandemic physician rhinologist balance responsibility manage patient upper airway adequately protect droplet aerosol transmission review summarise key update epos endotype base classification biomarker role biological crs lesson draw use severe asthma examine finally principle crs management covid- discuss
138,study aim explore social distancing self isolation measure aim protect vulnerable group covid- affect wellbeing physical activity level adult diagnose asthma seven participant take online focus group transcript analyse thematic analysis participant report health conscious label vulnerable relationship severity asthma alter report make positive change increase physical activity level finding suggest window opportunity engage people diagnose asthma promote beneficial lifestyle change self management
139,purpose review pediatric coronavirus disease  covid- respiratory disease distinct entity adult illness notable mild phenotype review summarize current knowledge clinical pattern cellular pathophysiology epidemiology covid- respiratory disease child specific attention factor account maturation relate difference disease severity recent finding past  month knowledge clinical presentation pathophysiology covid- pneumonia rapidly expand decreased disease severity covid- pneumonia child early observation difference efficiency viral cell entry timing immune recognition response child adult remain center ongoing research summary clinical spectrum covid- respiratory disease child define age relate difference protect child severe disease death remain incompletely understand
140,background coronavirus disease  covid- contagious disease symptom risk factor newly describe allergic disease include asthma define risk factor poor outcome covid- aim investigate role allergic disease allergic rhinitis severity covid- method case control study conduct sakarya educational research hospital toyota hospital yenikent state hospital march  august study include case group  randomly select patient diagnose allergic rhinitis advance have covid- control group  patient allergic rhinitis diagnose covid- evaluate participant status smoking symptom hospitalization length hospitalization number comorbiditie result statistically significant difference group percentage asymptomatic patient p presence smoking p hospitalization status p hospitalization length p group patient need care intensive care unit icu patient case group control group die covid- conclusion find allergic rhinitis affect severity covid- recommend literature augment study covid- prognosis patient allergic rhinitis
141,background insurgence covid- pandemic people die past month situation ongoing increase health social economic panic vulnerability country rely different preventive action control outcome covid- necessary boost knowledge effectiveness action policymaker country base appropriate action study generate evidence take impactful action combat covid- objective order generate community base scientific evidence study analyze outcome covid- response different control measure healthcare facility life expectancy prevalent disease method country datum collect different database perform comparative graphical analysis non linear correlation estimation r. result reduction covid- case strongly correlate earliness preventive initiation apathy take nationwide immediate precaution measure identify critical reason circumstance bad significant non linear relationship covid- case fatality number physician ncc p value /= nurse midwife ncc p value /= hospital bed ncc p value /= life expectancy sex ncc p value /= life expectancy female ncc p value /= life expectancy male ncc p value /= covid- death find reduce increase medical personnel hospital bed interestingly association comorbiditie severity covid- find exclude asthma cancer alzheimer smoking conclusion enhance healthcare facility early impose control measure valuable prevent covid- pandemic association covid- comorbiditie warrant investigation pathobiological level
142,background large airway epithelial barrier provide line defense respiratory virus include sars cov- cause covid- substantial inter individual variability individual disease course hypothesize partially mediate differential regulation gene interact sars cov- virus involve subsequent host response comprehensively investigate non genetic genetic factor influence covid relevant bronchial epithelial gene expression method analyze rna sequence datum bronchial epithelial brushing obtain uninfected individual relate ace gene expression host environmental factor spiromics cohort smoker chronic obstructive pulmonary disease copd replicate association asthma cohort sarp mast identify airway biology ace binding contribute increase susceptibility gene set enrichment analysis determine gene expression change indicative suppress airway immune response observe early sars cov- infection observe association host factor identify host genetic variant affect covid- susceptibility spiromics perform expression quantitative trait eqtl mapping investigate phenotypic association eqtl variant result find ace expression high relation active smoking obesity hypertension know risk factor covid- severity association interferon relate inflammation drive truncated non binding ace isoform discover expression pattern suppress airway immune response early sars cov- infection compare virus similar pattern associate obesity hypertension cardiovascular disease contribute covid susceptible airway environment eqtl mapping identify regulatory variant gene implicate covid- phewas evidence potential role respiratory infection conclusion datum provide evidence clinically relevant variation expression covid related gene associate host factor environmental exposure likely host genetic variation
143,background scarce publish datum differentiated thyroid cancer patient new coronavirus disease  covid- disease outcome mortality evaluate covid- infection outcome mortality thyroid cancer patient covid- infection design method include cohort patient thyroid cancer pcr confirm covid- disease  march   turkish ministry health database nationwide retrospective study compare mortality morbidity covid patient thyroid cancer univariate multivariate analysis assess independent factor mortality length hospital stay intensive care unit icu admission mechanical ventilation analyse effect radioiodine treatment severity death rate covid- disease result evaluate  covid- patient thyroid cancer median age  year interquartile range iqr  year male age gender match  covid- patient thyroid cancer patient thyroid cancer similar mortality ratio compare non cancer group patient thyroid cancer age presence diabetes mellitus asthma copd heart failure chronic kidney disease prior coronary artery disease ras blocker usage low lymphocyte count associate mortality radioactive iodine rai treatment cumulative radioactive iodine dosage negatively affect severity mortality covid- disease patient group conclusion study indicate history thyroid cancer increase risk mortality morbidity covid- disease rai therapy history dose radioactive iodine affect mortality outcome
144,objective previous study report correlation coronavirus disease- covid- asthma datum asthma constitute risk factor covid- prevalence asthma covid- case remain scant interrogate analyze association covid- asthma method study systematically search pubmed embase web science database study publish january  august include study report epidemiological clinical feature covid- prevalence asthma patient exclude review animal trial single case report small case series study evaluate coronavirus relate illness raw datum study pool meta analysis result analyze finding  study include asthma patient covid- pooled prevalence asthma covid- case ci .- overall .% p datum indicate asthma increase risk develop severe covid- odd ratio ci p i()=% addition significant difference incidence asthma age covid- infection ci p i()=% conclusion take datum suggest asthma significant risk factor development severe covid-
145,background december coronavirus disease  covid- emerge wuhan city spread rapidly china world aim describe clinical feature risk factor predictor hospitalization adult patient treat acute respiratory infection associate coronavirus sars cov- material method descriptive prospective study ambulatory hospitalize adult patient confirm covid- attend april  clinical feature chronic comorbiditie demographic datum record patient follow month outpatient result assess adult age   year man laboratory confirm covid- comorbiditie specially hypertension .% hypothyroidism .% asthma diabetes hospital admission require .% admit critical care unit .% connect mechanical ventilation common symptom include fatigue .% fever .% headache .% anosmia dysgeusia .% dry cough .% dyspnea .% diarrhea patient report persistence symptom month follow specially fatigue cough dyspnea multivariate analysis age fever cough dyspnea immunosuppression associate hospitalization icu admission age male sex moderate severe dyspnea associate requirement mechanical ventilation main predictor prolonged clinical course female sex presence comorbiditie history dyspnea cough myalgia abdominal pain conclusion clinical feature covid- highly unspecific prediction model severity help medical decision making primary care setting
146,purpose chest x ray cxr severity score bmi base obesity predictive risk factor covid- hospital admission relationship abdominal obesity cxr severity score fully explore method retrospective cohort study analyze association different adiposity index include waist circumference body mass index bmi cxr severity score  hospitalize patient covid- result patient abdominal obesity show significantly high cxr severity score high rate cxr severity score  compare abdominal obesity p /=  p p respectively waist circumference waist height ratio whtr correlate closely cxr severity score bmi r p /= vs p multivariate analysis indicate abdominal obesity risk ratio ci p bronchial asthma risk ratio ci p oxygen saturation admission risk ratio ci p independent factor associate high cxr severity score conclusion abdominal obesity phenotype associate high cxr severity score well bmi base obesity hospitalize patient covid- visit patient hospital setting waist circumference measure patient abdominal obesity monitor closely level evidence cross sectional descriptive study level v.
147,objective determine demographic clinical characteristic underlie comorbiditie outcome child coronavirus disease  covid- infection method retrospective study report  pediatric patient age year confirmed covid- march  july king abdulaziz university hospital jeddah saudi arabia result comorbid condition include cardiac neurological respiratory malignant disorder report  patient prominent present complaint fever cough patient .% mild disease .% moderate disease .% exhibit severe critical illness patient .% hospitalize  patient .% admit pediatric intensive care unit  .% patient die conclusion pediatric age group susceptible covid- gender difference covid- infection result critical illness mortality subset pediatric patient
148,objective aim study evaluate factor predict severe symptomatic laboratory confirm reverse transcription polymerase chain reaction rt pcr polymerase chain reaction severe acute respiratory syndrome coronavirus  sars cov- reinfection study design nationwide retrospective cohort study conduct mexico method datum  reinfection case  day episode onset analyze risk ratio rrs confidence interval cis evaluate predictor severe dyspnea require hospital admission secondary sars cov- infection result risk severe disease observed overall fatality rate patient primary disease likely develop severe symptom .% vs. .% p reinfection multiple analysis factor associate increase risk severe symptomatic sars cov- reinfection increase age rrper year ci comorbiditie obesity rr ci asthma rr ci type  diabetes mellitus rr ci previous severe laboratory confirm coronavirus disease  rr ci conclusion good knowledge study evaluate disease outcome large set laboratory positive case symptomatic sars cov- reinfection factor associate illness severity characterize result contribute current knowledge sars cov- pathogenicity identify population increase risk poor outcome reinfection
149,purpose review datum effect coronavirus disease  covid- host microbiome alteration subsequent effect susceptibility clinical course covid- especially atopic patient currently limited review study microbiome atopic patient respiratory infection discuss potential role probiotic therapeutic target covid- decrease susceptibility severity covid- recent finding respiratory tract virus infection affect gut airway microbiome structure host immune function diverse factor atopic disease affect airway gut microbiome structure expect negatively influence host health response respiratory virus infection atopic host depend preexisting microbiome immune response explain inconclusiveness effect covid- susceptibility morbidity mortality patient atopic disease beneficial probiotic therapeutic adjuvant covid- infection beneficial microbiome decrease viral load early phase respiratory virus infection improve morbidity mortality summary application probiotic potential adjuvant treatment respiratory virus infection improve host immune response disturbed microbiome structure atopic patient related study involve covid- warrant near future
150,extremely premature infant demonstrate increase survival advancement care population risk decrease lung function persist adolescence important clinician consider history treat assess patient contract sars cov- respiratory infection -year old premature infant  week gestation bpd present pediatric emergency department evaluation hypoxia increase work breathing setting sars cov- infection manage aggressively early noninvasive respiratory support remdesevir systemic steroid convalescent plasma utilization aggressive medical therapy early hospital course assist prevent intubation mechanical ventilation patient study examine severity sars cov- infection premature infant paucity datum vulnerable group age adolescence study need assess severity illness optimal management population
